precio_alquiler,expensas,direccion,superficie,ambientes,habitaciones,banos,descripcion,url,scraped_at,pagina,moneda_original,precio_alquiler_original,barrio,precio_por_m2,costo_total,categoria_tamano
750000,130000.0,Avenida Avellaneda 2900,62.0,3,2.0,1.0,"Corredor Responsable: Raul Nerguizian cpi 4272 - cmzc 625- Contacto: Damián Olguin. alquiler tres ambientes en flores-septimo piso contra frente con balcon-amplia cocina con lavadero Y doble ingreso-2 dormitorios con placard-living comedor Y gran balcon de 7 metros - en pleno centro comercial -inmejorable ubicacion -avellaneda Y nazca-todos los medios de transporte( tren, colectivos Y subte) -A 4 cuadras de la estacion san pedrito de la linea A de subterraneos-contrato por 1 año renovable, con ajuste trimestral por ipc-se requiere garantia propietaria O seguro de caucion Y recibos de sueldo. - Remax Argentina S. R. L. No ejerce el corretaje inmobiliario. El presente sitio web es una plataforma en donde cada oficina inmobiliaria independiente que contrata los servicios re/max puede publicar las propiedades a su cargo. Cada oficina es de propiedad y gestión independiente, por lo que Remax Argentina S. R. L no interviene en los datos de la publicación, en la operación inmobiliaria, ni en la confección y/o firma del boleto de compraventa y/o escritura y/o contrato de alquiler. En cumplimiento de las leyes vigentes que regulan el corretaje inmobiliario, Ley Nacional 25. 028, Ley 22. 802 de Lealtad Comercial, Ley 24. 240 de Defensa al Consumidor, las normas del Código Civil y Comercial de la Nación y Constitucionales, los agentes/gestores no ejercen el corretaje inmobiliario. Todas las operaciones inmobiliarias son objeto de intermediación y conclusión por parte del corredor público inmobiliario colegiado a cargo de la publicación, cuyos datos se exhiben en la presente. La presente publicación describe las características esenciales del inmueble, debiéndose consultar al corredor público inmobiliario responsable de la operación por la eventual actualización de las medidas, descripciones arquitectónicas y funcionales, valores de expensas, servicios, impuestos, precios y demás información, cuyos valores son aproximados. Para los casos de alquiler de vivienda, el monto máximo de comisión que se le puede requerir a los propietarios será el equivalente al cuatro con quince centésimos por ciento (4, 15%) del valor total del respectivo contrato. Se encuentra prohibido cobrar a los inquilinos que sean personas físicas comisiones inmobiliarias y gastos de gestoría de informes. El inmueble no es accesible para personas con discapacidades físicas.",https://www.zonaprop.com.ar/propiedades/clasificado/alclapin-alquiler-3-ambientes-flores-contra-frente-c-balcon-56184879.html,2025-05-28 02:15:44.239237,6,ARS,750000,Flores,12096.774193548386,880000.0,Mediano
600000,127000.0,Yerbal al 2500,73.0,3,2.0,1.0,"Excelente departamento en alquiler - 3 ambientes con balcón. Ubicación: A metros de la estación de subte y tren, con fácil acceso a transporte público y cercanía a servicios. Características: - 3 ambientes, con buena distribución. - Balcón a la calle, con luz natural. - Cocina independiente, amplia y funcional. - Lavadero separado, para mayor comodidad. - Aceptan seguro de caución como garantía. Ideal para quienes buscan un lugar cómodo, bien ubicado y con buena relación calidad-precio. Contactar para más información o coordinar visita. Oportunidad imperdible.",https://www.zonaprop.com.ar/propiedades/clasificado/alclapin-departamento-flores-56077916.html,2025-05-28 02:15:49.057447,6,ARS,600000,Flores,8219.17808219178,727000.0,Mediano
450000,80000.0,Yerbal 3800,40.0,2,1.0,1.0,"Alquiler Vivienda Dos Ambientes cómodos por escalera. En excelente y conectada ubicación frente a la estación Floresta del Sarmiento. Dos años de contrato Ajusta Cuatrimestral por indice ipc. Requisitos excuyentes, recibos de sueldo y garantía propietaria familiar de caba o seguro de caución Finaer",https://www.zonaprop.com.ar/propiedades/clasificado/alclapin-departamento-2-ambientes-en-alquiler-en-flores-56318480.html,2025-05-28 02:15:51.938407,6,ARS,450000,Flores,11250.0,530000.0,Pequeño
550000,110000.0,José Bonifacio 1900 PB,50.0,3,2.0,1.0,"Departamento de 3 ambientes apto profesional en pleno corazón del barrio de Flores. Planta baja, interno, en muy buen estado. Hall a living comedor con salida al patio, baño completo y dos amplios dormitorios, placard en hall íntimo. Cocina totalmente equipada. Son 45 m2 aproximadamente. Servicios individuales. Ideal para el uso profesional por su cercanía al centro comercial del barrio de Flores, Av. Rivadavia a 3 cuadras, subte línea ""A"", bancos, colegios, etc. Mat. 356 cucicba. ""Para los casos de alquiler de vivienda, el monto máximo de comisión que se le puede requerir a los propietarios será el equivalente al cuatro con quince centésimos por ciento (4, 15%) del valor total del respectivo contrato. Se encuentra prohibido cobrar a los inquilinos que sean personas físicas comisiones inmobiliarias y gastos de gestoría de informes"". - Accesible (Ley 5. 115): No.",https://www.zonaprop.com.ar/propiedades/clasificado/alclapin-alquiler-departamento-de-3-ambientes-flores-55497964.html,2025-05-28 02:15:57.056806,6,ARS,550000,Flores,11000.0,660000.0,Pequeño
450000,50000.0,CONDARCO,40.0,2,1.0,1.0,"Amplio 2 ambientes cerca de la av avellaneda, con facil acceso de colectivos! Habitacion amplian con placard. baño completo. cocina independiente. living amplio. - Martillero responsable: Alexis Levy | cucicba Matrícula Nº3995",https://www.zonaprop.com.ar/propiedades/clasificado/alclapin-condardo-al-400-2-ambientes-en-alquiler-56329016.html,2025-05-28 02:15:59.190883,6,ARS,450000,Flores,11250.0,500000.0,Pequeño
650000,100000.0,Av. Varela 760,61.0,2,1.0,1.0,"Excelente Dos Ambientes + Escritorio. Excelente departamento con detalles de categoría en Flores. Ambientes: . Hall de ingreso. . Living comedor. . Cocina. . Baño. . Dormitorio con placard. . Escritorio independiente. Con balcón corrido de deck, muy luminoso y amplio. A 200mts de la estación Varela del Subte E y a 700mts de la estación San Pedrito del subte A, gran cantidad de línea de colectivos tanto en Av. Rivadavia como en Av. Eva Perón y la línea 132 a 40mts. El Dto. Cuenta con preinstalación de aires acondicionados (caños en pared). A cargo del Locatario: Expensas incluyen agua y gas central de edificio. Luz (Edesur). Abl. Requisitos: . Ingresos acordes al canon locativo. . No apto mascotas. Condiciones: . Mes ingreso. . Dos meses de depósito. . Informes de la garantía. . Ajuste cuatrimestral",https://www.zonaprop.com.ar/propiedades/clasificado/alclappa-excelente-dos-ambientes-escritorio-56315729.html,2025-05-28 02:16:04.138533,6,ARS,650000,Flores,10655.737704918032,750000.0,Mediano
370000,76000.0,Ramon L Falcon al 2900,32.0,1,0.0,1.0,"Alquiler en flores. Monoambiente divisible, moderno Y luminoso. Contrafrente con balcon. pisos de porcelanato. Cocina integrada con muebles bajos, cocina A gas. Baño completo con bañera Y vanitory. Estufa tiro balanceado. Agua caliente por calefon A gas. Lavadero con instalacion en balcon. AntigÛedad 15 años. 1 cuadra de av rivadavia (una cuadra de estacion san pedrito de subte linea A. Se deja constancia que las Expensas que se mencionan corresponden al día que se carga la Propiedad. Deberá consultarse las mismas al momento de reservarse el Inmueble. -Las medidas que se expresan son aproximadas. -“Para los casos de alquiler de vivienda, el monto máximo de comisión que se le puede requerir a los propietarios será el equivalente al cuatro con quince centésimos por ciento (4, 15%) del valor total del respectivo contrato. Se encuentra prohibido cobrar a los inquilinos que sean personas físicas comisiones inmobiliarias y gastos de gestoría de informes”. jose mauricio adaszko matricula cucicba Nº 712",https://www.zonaprop.com.ar/propiedades/clasificado/alclapin-flores-monoambiente.-contrafrente-con-balcon.-56059700.html,2025-05-28 02:16:09.213188,6,ARS,370000,Flores,11562.5,446000.0,Pequeño
395000,60000.0,Bacacay 2700,30.0,2,1.0,1.0,"2amb 30m2, lateral 6to. Piso or Este, muy luminoso * Living comedor 4. 5x3 * Dormi 3. 2x3 c/placard amplio * Cocina y baño * Pisos parquet * Edificio de 7 pisos, 3 unidades x piso * A 3 cuadras de terminal estación San Pedrito, 1 cuadra del tren Sarmiento, 2 cuadras de Av. Rivadavia y 2 cuadras de Av. Nazca * Expensas $ 60mil * Alquiler $ 395mil * se aceptan recibos de sueldo * Las medidas son aproximadas - información: “Para los casos de alquiler de vivienda, el monto máximo de comisión que se le puede requerir a los propietarios será el equivalente al cuatro con quince centésimos por ciento (4, 15%) del valor total del respectivo contrato. Se encuentra prohibido cobrar a los inquilinos que sean personas físicas comisiones inmobiliarias y gastos de gestoría de informes”. - Consultas: panorama 0Ver datos. -",https://www.zonaprop.com.ar/propiedades/clasificado/alclapin-flores-2-amb-m-luminoso-bacacay-y-condarco-$395-52243092.html,2025-05-28 02:16:14.777726,6,ARS,395000,Flores,13166.666666666666,455000.0,Muy pequeño
1150000,,Bonorino 159,69.0,2,1.0,1.0,2 ambientes a estrenar de 69 m2 piso 12º al frente con balcón terraza Vista Panoramica - Calefacción por piso radiante eléctrico- Porcelanatos y pisos de categoría - Ventanales amplios a exteriores de aluminio línea Módena con doble vidrio hermético aislante de ruidos exteriores - Grifería y Losa de 1° calidad. Salón de usos múltiples 50mts² con salida a terraza con pileta y parrilla. Espacio guarda Bicicletas Cubierto en cada piso. Cercanía a Av. Rivadavia con amplias posibilidades de movilización y transporte público ( subte A) centro comercial del barrio de Flores.,https://www.zonaprop.com.ar/propiedades/clasificado/alclapin-2-amb-a-estrenar-69-m-sup2--bcon-tza-incluye-expensas-55545500.html,2025-05-28 02:16:18.380716,6,ARS,1150000,Flores,16666.666666666668,1150000.0,Mediano
625000,150000.0,Avellaneda 2700 5°,65.0,3,2.0,2.0,"¡Oportunidad única en Flores! Alquiler de espectacular departamento de 3 ambientes, recientemente pintado a nuevo, con excelente luminosidad en todos los espacios. Cuenta con: Amplio salón comedor lleno de luz natural. Cocina independiente con lavadero independiente. 2 dormitorios confortables con placares empotrados. Baño completo y toilette de cortesía. Ubicación privilegiada en Avellaneda al 2700, a pocos metros de Av. Nazca, Av. San Pedrito y Av. Rivadavia. Zona de fácil acceso y múltiples opciones de transporte. Para los casos de alquiler de vivienda, el monto máximo de comisión que se le puede requerir a los propietarios será el equivalente al cuatro con quince centésimos por ciento (4, 15%) del valor total del respectivo contrato. Se encuentra prohibido cobrar a los inquilinos que sean personas físicas comisiones inmobiliarias y gastos de gestoría de informes. ¡No dejes pasar esta oportunidad! Contáctanos para agendar una visita.",https://www.zonaprop.com.ar/propiedades/clasificado/alclapin-dpto-3amb-bcon-lav-bano-y-toil-lumin-pintado-a-nuevo-55905576.html,2025-05-28 02:16:24.215500,6,ARS,625000,Flores,9615.384615384615,775000.0,Mediano
500000,45000.0,Fray Cayetano 1191 y Gaona,42.0,2,1.0,1.0,Fray Cayetano esquina Gaona. Hermoso dto 2 amb en 7mo piso lateral con 2 balcones franceses. Muy luminoso. Cocina separada y Lavadero muy bien equipado,https://www.zonaprop.com.ar/propiedades/clasificado/alclapin-2-amb-flores.-muy-bueno-56248195.html,2025-05-28 02:16:28.148607,6,ARS,500000,Flores,11904.761904761905,545000.0,Pequeño
350000,50000.0,Yerbal 2745,34.0,2,1.0,1.0,"Luminoso departamento de dos ambientes, en edificio de 9 pisos 5 departamentos por piso, dos ascensores, conexión para lavarropas, baño con ducha y multifast. A una cuadra de Rivadavia y dos del subte. No es apto perros. Se solicita garantía propietaria de caba o seguro de caución. Contrato a 24 meses indexado trimestralmente por icl. Para entrar es un mes de depósito y uno de garantia. Matricula cucicba 8764",https://www.zonaprop.com.ar/propiedades/clasificado/alclapin-alquiler-depto-2-amb.-bajas-expensas-flores-apto-56269209.html,2025-05-28 02:16:30.334978,6,ARS,350000,Flores,10294.117647058823,400000.0,Pequeño
350000,,Av Directorio 2350. Entre Membrillar y Rivera indarte,19.0,1,0.0,1.0,"Alquiler de Departamento monoambiente en Flores, Capital Federal. expensas $75. 000. no se aceptan mascotas. Recién pintado. Listo para habitar. Transportes Cercanos. Colectivos: 88, 92, 113, 126, 132, 134, 180. Datos útiles. Barrio: Flores. Comuna: Comuna 7. Área Hospitalaria: htal. Dr. P. Piñero. Comisaría Comunal: 7. Comisaría Vecinal: 7A. Distrito Escolar: Distrito Escolar xi. Código Postal: 1406. pida tasación: Efectuada por profesionales, que analizan permanentemente el desenvolvimiento del mercado. Confíenos su patrimonio somos la mejor opción. Crescendo consultora inmobiliaria. Se deja constancia que los m2 son aproximados, al igual que las medidas parciales y el valor consignado de las expensas mensuales (en caso que corresponda pago de expensas) están sujetos a verificación y/o ajustes, el precio del inmueble puede ser modificado sin previo aviso. En el caso de tratarse de un inmueble en construcción los detalles de terminación y la fecha de entrega están sujetos a revisión. Fotos de carácter no contractual. Las unidades publicadas están sujetas a disponibilidad. Crescendo Consultora Inmobiliaria actúa solamente en carácter de comercializadora de los inmuebles ofrecidos. En caso de tratarse de un terreno, la información de m2 construibles es orientativa, debiendo ser constatada por el interesado. Inmueble no accesible para personas con discapacidad física ley 5115. Únicamente en el caso de tratarse de alquiler de vivienda familiar, rige lo indicado en la ley 5859. xintel(crs-crs-789)",https://www.zonaprop.com.ar/propiedades/clasificado/alclapin-alquiler-monomb-cerca-del-subte.-av-directorio-2300-49406081.html,2025-05-28 02:16:35.282773,6,ARS,350000,Flores,18421.052631578947,350000.0,Muy pequeño
630000,220000.0,Juan Bautista Alberdi al 2200,74.0,3,2.0,1.0,"Departamento de tres ambientes con dependencia y balcón. La unidad cuenta con un living comedor, con balcón al frente, dos habitaciones, cocina completa con conexión para lavarropas, baño completo, dependencia de servicio con su respectivo baño. Excelente ubicación, a dos cuadras de Av. Rivadavia, donde se encuentran múltiples medios de locomoción y locales comerciales. Contrato por dos años con ajustes trimestrales con indice icl.",https://www.zonaprop.com.ar/propiedades/clasificado/alclapin-departamento-3-ambientes-con-dependencia-y-balcon-al-56329708.html,2025-05-28 02:16:39.837594,6,ARS,630000,Flores,8513.513513513513,850000.0,Mediano
625000,150000.0,Avellaneda,55.0,3,2.0,2.0,"Propiedad única. excelente departamento de 3 ambientes ubicado en lo mejor del barrio de Flores. Sobre la avenida más importante del barrio y a solo metros de las demás, por lo que cuenta con facilidad de acceso a todos los medios de transporte. Totalmente reciclado!! Oportunidad. Consultanos!",https://www.zonaprop.com.ar/propiedades/clasificado/alclapin-avellaneda-2743-55094564.html,2025-05-28 02:16:45.356703,6,ARS,625000,Flores,11363.636363636364,775000.0,Mediano
500000,62000.0,Argerich al 600,42.0,2,1.0,1.0,2 amb lateral cocina C/ lavadero incorporado baño completo - se permiten mascotas - 42 m2gavilan propiedades Ver datos/6570 O wpp Ver datos,https://www.zonaprop.com.ar/propiedades/clasificado/alclapin-2-amb-lat-42-m-sup2-55806050.html,2025-05-28 02:16:48.833125,6,ARS,500000,Flores,11904.761904761905,562000.0,Pequeño
700000,130000.0,Quirno 70,110.0,3,2.0,1.0,"Esta. es. una exclente. unkdad ubicada. en el. corazon de. flores. con acceso A toda. caba Y provincia, medios de. transporte,. comercios. ennun. primer pisos con ascensor, encontramos éste hermoso departamento. super. luminoso. Imperdible. para. familias tipo, que quieran disfrutar de un amplio living cocina terraza Y cochera para. dos autos peqieños. No dejes de consultar. Requisitos. garantia propietaria O seguro de caucion Y primoridialmente poder tener rec9mendaciones del. lugar donde. actualmente alquila. mes. adelantado. mes de. deposito. comunicate para. gestionar una visita!!",https://www.zonaprop.com.ar/propiedades/clasificado/alclapin-hermoso-3-ambientes-c-cochera-y-terraza-55199082.html,2025-05-28 02:16:53.543263,6,ARS,700000,Flores,6363.636363636364,830000.0,Grande
430000,110000.0,Bolivia 500,30.0,1,0.0,1.0,"Se alquila un monoambiente nuevo, ubicado en Bolivia al 500, barrio de Flores. Descripción: - Cocina integrada. - Ambiente amplio. - Baño completo. El edificio cuenta con: - sum. - gym. - Terraza con Parrilla. - Laundry. Requisitos: - Recibos de sueldo que acrediten antigüedad y solvencia. - Seguro de Caución. - Mes de Adelanto. - Mes de depósito. Condiciones: - Valor del alquiler $430. 000. - Expensas $110. 000 (incluye luz y agua) - Contrato por 24 meses. - Actualización trimestral por ipc. - Acepta mascota. Empresa familiar en el barrio de Barracas. Espeche propiedades. cucicba 7061. Aviso legal: Las descripciones arquitectónicas y funcionales, valores de expensas, impuestos y servicios, fotos y medidas de este inmueble son aproximados. Los datos fueron proporcionados por el propietario y pueden no estar actualizados a la hora de la visualización de este aviso por lo cual pueden arrojar inexactitudes y discordancias con las que surgen de las facturas, títulos y planos legales del inmueble. - kpVer datos - kpdVer datos- - Publicado usando KiteProp crm Inmobiliario",https://www.zonaprop.com.ar/propiedades/clasificado/alclapin-alquiler-un-monoambiente-al-frente-a-estrenar-flores-56144478.html,2025-05-28 02:16:59.060153,6,ARS,430000,Flores,14333.333333333334,540000.0,Muy pequeño
500000,105000.0,Beltrán 41,41.0,1,0.0,1.0,Hermoso monoambiente cfte balcon - vista abierta cocina integrada - lavadero incorporado - baño completolas expensas incluyen aysa - el edificio cuenta con agua caliente central Y sum. excelente ubicacion se entrega sin muebles. Gavilan propiedadesVer datos/6570 O wpp 11 Ver datosgavilan propiedadesfijo: Ver datos/6570 - Mensaje de Wpp: Ver datos,https://www.zonaprop.com.ar/propiedades/clasificado/alclapin-hermoso-monoambiente-cfte-balcon-vista-abierta-55846007.html,2025-05-28 02:17:01.265039,6,ARS,500000,Flores,12195.121951219513,605000.0,Pequeño
600000,125000.0,Yerbal al 2100,52.0,3,2.0,1.0,3 amb al frente con amplio balcón corrido52M2 -gavilan propiedades Ver datos O wpp: 11 Ver datosgavilan propiedadesfijo: Ver datos/6570 - Mensaje de Wpp: Ver datos,https://www.zonaprop.com.ar/propiedades/clasificado/alclapin-3-amb-fte-bcon-corrido-52-m-sup2--muy-bueno-flores-56339428.html,2025-05-28 02:17:06.124296,6,ARS,600000,Flores,11538.461538461539,725000.0,Mediano
750000,218000.0,Boyaca 236,73.0,3,2.0,2.0,"* semipiso de tres ambientes en alquiler * caballito / flores. Sobre Av Boyacá entre Bacacay y Bogotá, excelente zona por su fácil acceso, a solo dos cuadras de Av Avellaneda y a dos de Av Rivadavia, con cercanía a todos los medios de transporte y subte línea A estación Carabobo. Cuenta con, - Palier privado - Amplio living comedor con gran ventanal, salida a balcón corrido - Dormitorio principal orientado al contrafrente y salida a balcón- Segundo dormitorio orientado al pulmón del edificio- Ambos dormitorios con amplios placares y puertas espejadas- Dos baños completos - Cocina separada- Lavadero independiente. Características generales, - Pisos flotantes en todos los ambientes - Persianas en ambos dormitorios- Calefacción individual en cada ambiente. Agua caliente central. No se aceptan mascotas. disponible.",https://www.zonaprop.com.ar/propiedades/clasificado/alclapin-alquiler-de-tres-ambientes-en-caballito!-55995804.html,2025-05-28 02:18:13.222146,7,ARS,750000,Flores,10273.972602739726,968000.0,Mediano
650000,,Granaderos al 200,46.0,2,1.0,1.0,"2 ambientes de categoría premium, en flores a 2 cuadras de Rivadavia. Calefacción central por radiadores y agua caliente central. Espectacular balcón aterrazado corrido del living al dormitorio con vista panorámica. Puerta blindadaEdificio con amenities (solarium sum y parrilla) Lo mejor, el precio: Se alquila por paquete, total $ 650. 000 que incluyen: - Expensas, Aysa, y abl - Más el consumo de agua caliente y caldera que viene en las expensas. Lo que te permitirá ahorrar a la vez de tener un valor de gastos predecible en el de ingreso: - Garantía propietaria caba familiar directo o seguro de caución de empresas lider - Depósito usd 700 Super oportunidad No dejes de verlo.",https://www.zonaprop.com.ar/propiedades/clasificado/alclapin-alquiler-2-amb-categoria-en-flores-sin-expensas-56138998.html,2025-05-28 02:18:16.728728,7,ARS,650000,Flores,14130.434782608696,650000.0,Pequeño
400000,110000.0,Boyacá 736/ 9ºC,40.0,1,0.0,,"Se Alquila Bello Monoambiente en Boyacá 736/Edificio 3-Complejo Torres de Sol. Piso 9º C/Contra FrenteDescripciónÚnico espacio con diseño funcional divido con un gran placard completo, en excelentes condiciones y muy luminoso, con salida a balcón y excelente vista, ubicado en el piso 9°, unidad “C”, C. Frente. . Cocina integrada con muebles bajo y sobremesada, Baño completo con vanitory. Pisos de porcelanato, El edificio cuenta con un excelente hall de entrada, ascensor revestido en acero inoxidable, agua caliente central, laundry, sum, parrilla y jacuzzi. Sistema de portería y seguridad compartida con el complejo Torres del Sol. Condiciones: -Sistemas de Fianza, Garantías o Caución. -Comprobantes de Sueldo o certificación de ingresos avalada por un contador, legalizada por el colegio Profesional. -1mes de depósito-1mes de adelanto. -Pago de Expensa +abl $ 17. 000-No se aceptan mascotas-Contrato 24 meses-Alquiler ($400. 000) -Reajuste Trimestral por ipc -Justificación de ingresos $ 1. 200. 000 aprox.",https://www.zonaprop.com.ar/propiedades/clasificado/alclapin-se-alquila-depto-momo-ambientes-en-piso-alto-en-55740825.html,2025-05-28 02:18:21.656056,7,ARS,400000,Flores,10000.0,510000.0,Pequeño
550000,80000.0,Av. Carabobo al 100,45.0,2,1.0,1.0,"Departamento de 2 ambientes interno en 1º piso con balcón aterrazadoEdificio dos ascensoresCocina integrada con conexión de lavarropasDormitorio con placard y persianaBaño completo y antebañoApto Profesional. Expensas incluyen AysaMuy buena ubicación, a 2 cuadras de Av. Rivadavia y a metros de Av. Juan B. AlberdiAmenities: Piscina con jardín",https://www.zonaprop.com.ar/propiedades/clasificado/alclapin-alquiler-departamento-2-ambientes-en-flores-56139242.html,2025-05-28 02:18:26.191868,7,ARS,550000,Flores,12222.222222222223,630000.0,Pequeño
700000,,"Ramon L Falcon al 2600, Piso 1",38.0,2,1.0,1.0,"Edificio ubicado a una cuadra de Av. Rivadavia, múltiples líneas de colectivos y cercanía al subte A y ferrocarril Sarmiento. Departamento reciclado y amoblado en un primer piso por escalera. Posee living-comedor y dormitorio con pisos de parquet plastificado. Baño completo con ventilación al exterior en suite. Cocina con lavarropas y muebles de cocina completo. El equipamiento incluye mesa, sillas, sillón de dos cuerpos, heladera, lavarropas, microondas, aire acondicionado frío/calor, cama matrimonial, botinero, amplio placard y de más muebles incluidos en las fotografías. No incluye televisor. el precio incluye el valor de las expensas. El inquilino tendrá a cargo los servicios de luz, gas, Aysa, abl e impuesto inmobiliario. condiciones: - Justificación de ingresos acordes- Contrato a dos años con ajustes trimestrales por ipc- Depósito de garantía U$S 700- Garantía propietaria o seguro de caución. vremont Guzmán - Corredor inmobiliario Eduardo Guzmán - Matrícula N° 805 cucicbasr. Inquilino: Para los casos de alquiler de vivienda, el monto máximo de comisión que se le puede requerir a los propietarios será el equivalente al cuatro con quince centésimos por ciento (4, 15%) del valor total del respectivo contrato. Se encuentra prohibido cobrar a los inquilinos que sean personas físicas comisiones inmobiliarias y gastos de gestoría de informes. Se deja constancia que las medidas, superficies y m2 consignados son aproximados, sujetos a verificación y/o ajuste. El precio del inmueble puede ser modificado sin previo aviso. Ley 5115: excepto que en la descripción de la propiedad se indique lo contrario, el edificio puede no contar con rampa para personas con movilidad reducida, y no ser Accesible para personas con discapacidades físicas. -",https://www.zonaprop.com.ar/propiedades/clasificado/alclapin-ramon-falcon-2600-departamento-de-dos-ambientes-56200252.html,2025-05-28 02:18:30.956034,7,ARS,700000,Flores,18421.052631578947,700000.0,Pequeño
