precio_alquiler,expensas,direccion,superficie,ambientes,habitaciones,banos,descripcion,url,scraped_at,pagina,moneda_original,precio_alquiler_original,barrio,precio_por_m2,costo_total,categoria_tamano
450000,98000.0,Av. Eva Peron 2600,45.0,1,0.0,1.0,"Departamento en Venta de 1 ambientes en Flores, Capital Federal. Semipiso. Mono-ambiente divisible 9. 90x3/2. 70. Ascensor principal. 2 Unidades por planta. Cocina integrada con mueble bajo mesada y alacena. Lavadero incorporado. Pisos: Porcelanato, cerámica. Revestimiento de paredes: Pintura. Balcón al frente y contrafrente. Ameneties: Pequeño S. U. M con Parrilla. Expensas: $98. 000- (Enero 2025). El monto de expensas varía mes a mes y se recomienda consultar la actualización del mismo. El mismo se encuentra disponible, y las condiciones de alquiler son las siguientes: 1) Tener ingresos demostrables por el triple del valor del alquiler, tener estabilidad laboral con antigüedad mínima un año. 2) Contar con una garantía propietaria de familiar directo en el ámbito de C. A. B. A. De inmueble equivalente. En caso de no poder ofrecer garantía propietaria hay compañías de seguros de fianzas que ofrecen garantía para alquileres muy aceptada en el mercado inmobiliario. 3) Para ingresar es necesario pagar un mes por adelantado y un mes de deposito o equivalente en dolares. 4) Para el caso de monotributistas, presentar certificación de ingresos, hecho por contador publico nacional. Y la firma del contador deberá estar certificada por el consejo profesional en ciencias económicas. 5) Contrato por 2 años actualizable cada 3 meses, según el I. P. C. Publicado por el indec. 6) No se aceptan mascotas. Si está dentro de lo que usted está buscando, no dude en contactarse con nosotros. nota: Los m2. y medidas son aproximadas, no teniendo valor contractual, al igual que las imágenes. Valor de expensas sujeto a cambios. Inmueble Se encuentra prohibido cobrar comisiones inmobiliarias y gastos de gestoría a los inquilinos, que sean personas físicas y con destino viviendas. Comisión máxima para propietarios 4. 15 del valor del contrato. Los Edificios a estrenar no cuentan con agrimensura definitiva, siendo las medidas y superficies extraídas de planos de Arquitectura y por tal motivo solo orientativas, no teniendo las mismas valor contractual y estando sujetas a mensura definitiva. Las Unidades son comercializadas Ad-Corpus y no por superficie. aviso legal: Se hace saber que las características descriptas del inmueble publicado, calidades y cualidades constructivas y funcionales, valores de expensas, impuestos y servicios, y medidas y superficies, son aproximados y consignados en base a datos que fueron proporcionados por el propietario, no tienen valor contractual y que pueden no ser exactos y/o no estar actualizados a la hora de la visualización de este aviso, pudiendo surgir discordancias con los datos que emanen de la documentación respectiva. Las medidas y superficies exactas son las que surgen de los títulos y planos legales del inmueble. Las imágenes publicadas lo son al mero efecto orientativo de las características generales y circunstancias del inmueble en el momento en que han sido tomadas, pudiendo las mismas diferir del estado y circunstancias actuales del mismo. Asimismo, los mobiliarios, accesorios, elementos, y otros, que se visualizan en las imágenes publicadas, no integran la oferta de venta, salvo manifestación explícita, al contrario. En todos los casos el interesado deberá realizar una visita al inmueble y efectuar las verificaciones respectivas previamente a la realización de cualquier operación u oferta requiriendo la documentación que corresponda. Los valores están sujetos a cambios. Inmueble no accesible a personas con discapacidad física Ley 5115.",https://www.zonaprop.com.ar/propiedades/clasificado/alclapin-mono-ambiente-divisible-al-frente-en-flores-56238407.html,2025-05-28 02:08:48.954437,4,ARS,450000,Flores,10000.0,548000.0,Pequeño
300000,83000.0,Dr. Eleodoro Lobos al 200,24.0,1,0.0,1.0,"Monoambiente: Cocina separada - Baño completo Excelente estado. LuminosoAgua caliente centralApto profesional, oficina y/o consultorio. Excelente ubicación Transportes CercanosColectivos: 2, 5, 8, 15, 26, 36, 42, 55, 65, 84, 85, 86, 88, 92, 103, 104, 119, 132, 135, 141, 172, 181Subtes (Metro) : acoyte (Línea A) Requisitos: Garantía de caba e Ingresos comprobablesNo se permiten mascotas. Se entrega s/ muebles (a excepción del placard) -vremont TreusMatricula cucicba 6830 Corredor Inmobiliario: Matias Treus Peciar. --En el cumplimiento de la ley nacional 25. 028, ley 22. 802 de lealtad comercial. -Ley 24. 240 de defensa al consumidor, las normas del código civil y comercial de la nación y constitucionales. Los agentes no ejercen el corretaje inmobiliario. -Ley 5859 - Art. 4: &quot;Para los casos de alquiler de vivienda, el monto máximo de comisión que se le puede requerir a los propietarios será el equivalente al cuatro con quince centésimos por ciento (4, 15%) del valor total del contrato. Se encuentra prohibido cobrar a los inquilinos que sean personas físicas comisiones inmobiliarias y gastos de gestoría de informes&quot;. -Ley 5115 – Art. 1: El inmueble publicado no es accesible para personas con capacidades físicas reducidas. (Salvo que en la descripción figure lo contrario) -Se deja constancia que las medidas, superficies y m2 consignados son aproximados, sujetos a verificación y/o ajuste. El precio del inmueble puede ser modificado sin previo aviso.",https://www.zonaprop.com.ar/propiedades/clasificado/alclapin-dr.-eleodoro-lobos-200-departamento-1-ambiente-55892399.html,2025-05-28 02:08:52.629151,4,ARS,300000,Flores,12500.0,383000.0,Muy pequeño
380000,200000.0,"José Bonifacio 2734 2º ""B""",47.0,1,1.0,1.0,"Alquiler Departamento monoambienteInmejorable ubicación, en el Barrio de Flores, a una cuadra de Av. Directorio y a dos cuadras de Av. San Pedrito. Tres cuadras de la Av. Rivadavia. Cinco cuadras de Estación Carabobo Subte línea A. Y cerca de juan bautista alberdiEn edificio de 8 pisos, con sum y parrilla. Detalles: • Recien pintado• Living comedor con cocina integrada, amoblada en alacena y bajomesada • Revestimientos de pisos en cerámica esmaltada de primera calidad• Balcón al frente• Dormitorio con ventilación natural al exterior y placard empotrado. Pisos flotantes• Baño completo con bañeraExcelentes detalles y terminaciones• Posibilidad de cerrar y separar completamente el dormitoriorequisitos: Mes de adelantoMes de depositoGarantía de caba o seguro de caución finaercondiciones: Recibo de sueldoContrato a dos añosAumento trimestral por ipcnorde PropiedadesMatrícula 2014-cucicba",https://www.zonaprop.com.ar/propiedades/clasificado/alclapin-venta-alquiler-monoambiente-dividido-a-estrenar-en-56218295.html,2025-05-28 02:08:57.798039,4,ARS,380000,Flores,8085.106382978724,580000.0,Pequeño
360000,72000.0,DIRECTORIO 3200,30.0,1,0.0,1.0,"Alquiler de Departamento monoambiente en Flores, Capital Federal. Moderno y luminoso. Baño completo. Cocina integrada. Balcon al frente. No dudes en contactar tu visita! - Condiciones de Alquiler. -Contrato por 24 meses con Ajuste trimestral por ipc. -Mes de adelanto. -Mes de deposito en u$s. - solo Seguro de caución. -Ingresos Comprobables que tripliquen el valor de alquiler. Lepore propiedades Ver datos Ver datos lepore Propiedades S. A. Cuit: Ver datos-9 C. U. C. I. C. B. A. Matrícula Nº 931 (Sucursales Caballito - Palermo - Centro) aviso legal: Las descripciones arquitectónicas y funcionales, valores de expensas y/o gastos comunes, impuestos y servicios, fotos y medidas de este inmueble son aproximados. Los datos fueron proporcionados por el propietario y pueden no estar actualizados a la hora de la visualización de este aviso por lo cual pueden arrojar inexactitudes y discordancias con las que surgen de las facturas, títulos y planos legales del inmueble. El interesado deberá realizar las verificaciones respectivas con carácter previo a la realización de cualquier operación, requiriendo por sí o sus profesionales de confianza las copias necesarias de la documentación que corresponda. xintel(lep-lep-Ver datos)",https://www.zonaprop.com.ar/propiedades/clasificado/alclapin-departamento-1-ambiente.-directorio-al-3200-54774397.html,2025-05-28 02:09:02.809408,4,ARS,360000,Flores,12000.0,432000.0,Muy pequeño
800000,1.0,Avenida Nazca 600,54.0,2,1.0,1.0,"Corredor Responsable: Monica Alejandra Mazza cucicba 5609 / Ezequiel Luceti cmcpsi 6635- Contacto: Betina Cohen. Increible 2 ambientes a Estrenar en Flores. Ambientes grandes y luminosos. Apto vivienda o profesional. Balcon aterrzado. Dormitorio en suite. Living y toilette de Recepcion. Cocina amplia, con anafe y horno marca Domec. Pisos porccelanato. Equipos de aire Split frio-calor. Edificio con terminaciones de categoria, sum y Parrillas. Portero electrico digital con control de acceso. Seguridad 24 horas shomer apto shabat. Cocheras cubiertas o descubiertas Optativas. Consultar por otras unidades de 2, 3 y 4 amb con dependencia. Requisitos. garantia de caucion. 1 mes de deposito. consultar por otras unidades. Remax Argentina S. R. L. No ejerce el corretaje inmobiliario. El presente sitio web es una plataforma en donde cada oficina inmobiliaria independiente que contrata los servicios re/max puede publicar las propiedades a su cargo. Cada oficina es de propiedad y gestión independiente, por lo que Remax Argentina S. R. L no interviene en los datos de la publicación, en la operación inmobiliaria, ni en la confección y/o firma del boleto de compraventa y/o escritura y/o contrato de alquiler. En cumplimiento de las leyes vigentes que regulan el corretaje inmobiliario, Ley Nacional 25. 028, Ley 22. 802 de Lealtad Comercial, Ley 24. 240 de Defensa al Consumidor, las normas del Código Civil y Comercial de la Nación y Constitucionales, los agentes/gestores no ejercen el corretaje inmobiliario. Todas las operaciones inmobiliarias son objeto de intermediación y conclusión por parte del corredor público inmobiliario colegiado a cargo de la publicación, cuyos datos se exhiben en la presente. La presente publicación describe las características esenciales del inmueble, debiéndose consultar al corredor público inmobiliario responsable de la operación por la eventual actualización de las medidas, descripciones arquitectónicas y funcionales, valores de expensas, servicios, impuestos, precios y demás información, cuyos valores son aproximados. Para los casos de alquiler de vivienda, el monto máximo de comisión que se le puede requerir a los propietarios será el equivalente al cuatro con quince centésimos por ciento (4, 15%) del valor total del respectivo contrato. Se encuentra prohibido cobrar a los inquilinos que sean personas físicas comisiones inmobiliarias y gastos de gestoría de informes. El inmueble no es accesible para personas con discapacidades físicas.",https://www.zonaprop.com.ar/propiedades/clasificado/alclapin-alquiler-2-ambientes-a-estrenar-flores-amenities-56139809.html,2025-05-28 02:09:06.365655,4,USD,800,Flores,14814.814814814816,800001.0,Mediano
500000,40000.0,Beltran 35,42.0,1,0.0,1.0,"Departamento mono-ambiente con las dimensiones de un 2 amb, con posibilidad de división, balcón al frente dando con la calle Beltrán, muy arbolada, luminoso con orientación al oeste. La cocina está integrada con ventilación al exterior. Placard con interiores completos empotrado a la pared. La unidad cuenta con excelentes terminaciones y accesorios de primeras marcas. Conexión de lavarropas en el balcón, bajo techo y protegido! Está equipado listo para estrenar con aire acondicionado frío calor y extractor en cocina, cuyo funcionamiento es a gas. Apto profesional. Agua caliente central El edificio consta de pb + 12 pisos. Cuenta con 4 unidades por piso y dos ascensores, cada uno asignado a frente y contrafrente respectivamente. En el piso 12 tiene terraza con parrilla + espacio bicicletero, Se encuentra ubicado en el barrio de Flores, a media cuadra de av. Rivadavia. Colectivos: 1, 2, 5, 8, 25, 36, 44, 49, 53, 55, 76, 85, 86, 88, 92, 96, 99, 104, 113, 126, 132, 133, 134, 136, 141, 163, 172, 180Subte: línea A (estación Carabobo) Tren Sarmiento: (estación Flores) Superficie: Ambiente 9, 12x3, 26Cocina2, 20x1, 83Espacio heladera ancho 0, 64mTotal m2 cubiertos: 37, 79Total m2 descubiertos: 4. 71Total superficie en m2: 42, 5**Corredor Inmobiliario Responsable Adrian Ridelnik cucicba Mat 197. Y Mauro Ridelnik cucicba Mat 6933 y cmcpsi 7060*Se deja constancia que las medidas y superficies indicados son aproximados y al sólo efecto orientativo. Las medidas reales surgirán del título de propiedad respectivo. Las medidas parciales y/o de los ambientes y el valor consignado de expensas mensuales, servicios y abl está sujeto a verificación y/o ajuste. Art. 4 de la Ley 5. 859 de C. A. B. A &quot;Para los casos de alquiler de vivienda única, el monto máximo de comisión que se le puede requerir a los propietarios será el equivalente al cuatro con quince centésimos por ciento (4, 15%) del valor total del respectivo contrato. Se encuentra prohibido cobrar a los inquilinos que sean personas físicas comisiones inmobiliarias cuando el destino sea vivienda única y permanente &quot;. -",https://www.zonaprop.com.ar/propiedades/clasificado/alclapin-flores-excelente-ubicacion-monoamb-con-cocina-a-gas-y-56003122.html,2025-05-28 02:09:11.963673,4,ARS,500000,Flores,11904.761904761905,540000.0,Pequeño
680000,140000.0,Alberdi al 3000 6°,52.0,2,1.0,1.0,"Departamento 3 ambientes en alquiler con balcón al contrafrente La unidad posee una distribución funcional: en un amplio living comedor con salida al balcón, una cocina semi integrada a gas, un baño completo y dos dormitorios con placard sin interior. Algo para destacar es su excelente luminosidad y ventilación, contando con ventanas en todos sus ambientes. Incluye aire acondicionado y campana de cocina. Sus vidrios son dobles y anti-ruido. El edifcio dispone de una terraza semi-cubierta muy amplia con dos parrillas, ideal para eventos. Expensas: 140. 000No apto mascotas.",https://www.zonaprop.com.ar/propiedades/clasificado/alclapin-departamento-2-ambientes-con-balcon-en-alquiler-56339028.html,2025-05-28 02:09:16.905535,4,ARS,680000,Flores,13076.923076923076,820000.0,Mediano
500000,95000.0,Culpina 300,42.0,2,1.0,1.0,"Corredor Responsable: Ariel Champanier cucicba 4330 / Andrea Berré cmcpsi 6763- Contacto: Eduardo Cafferata. En el barrio de Flores. Edificio de 55 años de antigüedad. Entrada y hall de entrada reciclados, 2 ascensores, encargado permanente con vivienda, servicios individuales, bien conservado. Apertura de puerta de calle por llave electrónica tipo moneda. En la esquina de Culpina con Av. Directorio y a 200 metros de la Av. Juan B. Alberdi. Zona mixta (comercial/residencial). Colectivos: 63, 76, 88, 92, 96, 113, 126, 132, 134, 141, 180. El departamento, en muy buen estado, es un cómodo y súper luminoso 2 ambientes, al frente, con balcón corrido. Está compuesto por: Hall de entrada, cocina espaciosa, con conexión para lavarropas, en la que se puede armar un pequeño comedor, living comedor, hall de distribución con placard adicional, dormitorio con placard empotrado amplio y baño completo con bañera. La orientación del living comedor y del dormitorio es hacia el este por lo que cuenta, al ser un 5° piso y no tener edificios enfrente, con muchísimo sol directo durante toda la mañana y muy buena luminosidad el resto del día. La cocina ventila e ilumina hacia el oeste. Puerta de entrada blindada. Todos los pisos, a excepción de cocina y baño, son de parquet macizo en muy buen estado. En cocina son de mosaicos graníticos y en baño cerámicos. El balcón cuenta con red de seguridad. Tanto la ventana balcón de living como la ventana del dormitorio cuentan con persianas de madera. La instalación de gas completa del edificio está hecha a nuevo y funcionando según normativas Metrogas. La instalación eléctrica está hecha a nuevo y cuenta con llave térmica y disyuntor diferencial de corte. El agua caliente es por calefón, calefacciona con un tiro balanceado en el estar comedor. Condiciones: Un mes de alquiler por adelantado, un mes de depósito. Ajuste: trimestral según icl (ipc/ripte) Contrato a dos años. Expensas Ordinarias: A cargo del locatario. Expensas extraordinarias: A cargo del propietario. Abl, Aysa, suministro eléctrico Y gas: a cargo del locatario. Garantía: Financiera (Garantía Express/Finaer) No se aceptan mascotas. Atura de los techos: 2, 60 mts. Medidas: Cocina: 3, 16 x 2. Hall entrada: 1, 10 x 1, 41. Living comedor: 3 x 5, 15. Hall distribuidor: 0, 90 x 1, 50. Dormitorio: 3 x 3. Placard dormitorio: 0, 67 prof, 1, 75 ancho, 2, 40 altura. Balcón: 1 x 5, 90. Remax Argentina S. R. L. No ejerce el corretaje inmobiliario. El presente sitio web es una plataforma en donde cada oficina inmobiliaria independiente que contrata los servicios re/max puede publicar las propiedades a su cargo. Cada oficina es de propiedad y gestión independiente, por lo que Remax Argentina S. R. L no interviene en los datos de la publicación, en la operación inmobiliaria, ni en la confección y/o firma del boleto de compraventa y/o escritura y/o contrato de alquiler. En cumplimiento de las leyes vigentes que regulan el corretaje inmobiliario, Ley Nacional 25. 028, Ley 22. 802 de Lealtad Comercial, Ley 24. 240 de Defensa al Consumidor, las normas del Código Civil y Comercial de la Nación y Constitucionales, los agentes/gestores no ejercen el corretaje inmobiliario. Todas las operaciones inmobiliarias son objeto de intermediación y conclusión por parte del corredor público inmobiliario colegiado a cargo de la publicación, cuyos datos se exhiben en la presente. La presente publicación describe las características esenciales del inmueble, debiéndose consultar al corredor público inmobiliario responsable de la operación por la eventual actualización de las medidas, descripciones arquitectónicas y funcionales, valores de expensas, servicios, impuestos, precios y demás información, cuyos valores son aproximados. Para los casos de alquiler de vivienda, el monto máximo de comisión que se le puede requerir a los propietarios será el equivalente al cuatro con quince centésimos por ciento (4, 15%) del valor total del respectivo contrato. Se encuentra prohibido cobrar a los inquilinos que sean personas físicas comisiones inmobiliarias y gastos de gestoría de informes. El inmueble no es accesible para personas con discapacidades físicas.",https://www.zonaprop.com.ar/propiedades/clasificado/alclapin-departamento-2-ambientes-balcon-flores-alquiler-56316844.html,2025-05-28 02:09:20.148722,4,ARS,500000,Flores,11904.761904761905,595000.0,Pequeño
700000,35000.0,Aranguren al 2700,44.0,1,0.0,1.0,"Epectacular monoambiente de 44 metros totales, amplio y luminoso. Cuenta con un patio/balcon aterrazado al frente, cocina integrada al ambiente y un baño con ducha y conexion para lavarropas. Apto profesional/comercialcaracterísticas: -Carpinterías de aluminio con vidrio laminado de seguridad. -Puertas interiores blancas con buñas. Herrajes de aluminio marca Currao. -Baño equipado con artefactos y griferías de primera marca (fv y Roca). -Instalación sanitaria realizada con cañerías de primera marca (awaduct o similar). -Instalación prevista para cable (empresas prestadoras), telefonía y portero eléctrico. -Mesadas de granito negro Brasil. -Pre-instalación de cañeria de cobre y desague prevista para aire acondicionado. -Amoblamientos de cocina con moderno diseño de última generación. -Cielorrasos de hormigón a la vista. -Muros de ladrillo macizo entre unidades para una excelente aislacion acustica. -Ahorro en consumo electrico con iluminacion led. -Ahorro en consumo de agua con artefactos sanitarios de doble descarga. -Instalacion preparada para lavarropasUbicado en el corazón del barrio de Flores, zona comercial y con acceso a multiples medios de transporte. David SpanierMat. Cucicba Nº1878David Spanier - Mat. Cucicba Nª1878 - Arie Wajnstok cmcpsi 6569Las medidas, superficies consignadas en la presente descripción son aproximadas, a solo título orientativo y no son vinculantes. Las medidas y superficies reales surgen del Título respectivo.",https://www.zonaprop.com.ar/propiedades/clasificado/alclapin-venta-monoambiente-a-estrenar-con-patio-55662171.html,2025-05-28 02:09:23.644990,4,USD,700,Flores,15909.09090909091,735000.0,Pequeño
700000,85000.0,Av. Avellaneda al 2500,54.0,3,2.0,1.0,"Confortable 3 ambientes con balcón al frente. Es 5to piso, muy luminoso, bajas expensas. Su ingreso da a un amplio y luminoso living comedor con balcón corrido, al frente. A su vez, conecta a luminosa y cómoda cocina, que posee lavadero independiente. Del living parte un pasillo distribuidor que conecta a los dos dormitorios y al baño completo. Los ambientes son cómodos, ventilados, piso de parquet, persianas de madera y placards con interiores de madera. En cuanto a los servicios, son individuales. Gas y calefón en perfecto funcionamiento. La cocina de estreno, ha sido instalada recientemente por los propietarios. El edificio tiene 7 pisos, está muy bien conservado, tiene encargada con vivienda; cuenta con ascensor y escaleras de emergencia. Expensas: $ 85. 000*no se aceptan mascotas*requisitos: - Contrato tradicional por 2 (dos) años, Ajuste Trimestral x ipc. - Demostración de ingresos con recibo de sueldo. A la firma del Contrato: - Seguro de caución. - Mes adelantado. - Mes y medio de depósito. Dimensiones: Sup. Cub. 50m2Sup. Semicub. 2, 50m2 (lavadero) Sup. Desc. 2, 40m2 (balcón) Colectivos: 25, 53, 63, 92, 99, 113, 133, 134, 172Trenes: Flores (sarmiento) para una respuesta más rápida llamar al celular publicado O contactarse por whatsapp. - Disponible para entrar ya! Coordina visita. aviso legallas medidas son aproximadas, las reales surgen del titulo de propiedad o plano de mensura. Las imágenes son a mero título ilustrativo. Las descripciones y valores de expensas, impuestos y servicios son aproximados y fueron proporcionados por el propietario y pueden no estar actualizados a la hora de la visualización de este aviso. Los precios indicados podrán modificarse sin previo aviso. Venta supeditada al cumplimiento por parte del propietario de la solicitud de coti, requisito de la resolución general Nº 2371 de la afip. ley 5859 – art. 5“Se encuentra prohibido cobrar comisiones inmobiliarias y gastos de gestoría de informes a los inquilinos que sean personas físicas. Para los casos de alquiler de vivienda, el monto máximo de comisión que se le puede requerir a los propietarios será el equivalente al cuatro con quince centésimos por ciento (4, 15%) del valor total del respectivo contrato”Bötts Real EstateMartín BottgerMatrícula cucicba 8102 / cmcpsi 6853tasamos su propiedad en el diasomos profesionales altamente especializados en tasaciones para obtener el valor real de las propiedades utilizando los criterios más adecuados, respetando y cuidando el patrimonio del cliente que confía en nuestros servicios. aviso legallas medidas son aproximadas, las reales surgen del titulo de propiedad o plano de mensura. Las imágenes son a mero título ilustrativo. Las descripciones y valores de expensas, impuestos y servicios son aproximados y fueron proporcionados por el propietario y pueden no estar actualizados a la hora de la visualización de este aviso. Los precios indicados podrán modificarse sin previo aviso. Venta supeditada al cumplimiento por parte del propietario de la solicitud de coti, requisito de la resolución general Nº 2371 de la afip. Bötts Real Estate sasmartín BottgerMatrícula cucicba 8102 / cmcpsi 6853",https://www.zonaprop.com.ar/propiedades/clasificado/alclapin-depto-3-amb-en-alquiler-c-balcon-y-lavadero-en-55703998.html,2025-05-28 02:09:26.957347,4,ARS,700000,Flores,12962.962962962964,785000.0,Mediano
370000,90000.0,Jose Bonifacio 3025 6° Piso,28.0,1,1.0,1.0,"Departamento A estrenar monoambiente piso 6° en alquiler en flores- jose bonifacio al 3000. A 3 cuadras de las Av. Juan Bautista Alberdi, Av Directorio y Av. Rivadavia. Colectivos: 1, 2, 5, 8, 25, 36, 49, 53, 55, 63, 76, 85, 86, 88, 92, 96, 104, 113, 126, 133, 136, 141, 163, 180Subtes (Metro): san pedrito (Línea A) requisitos: -alquiler $ 370. 000-expensas aproximadas $ 90. 000-ajuste cada 3 meses por ipc. -1 mes de adelanto-1 mes de deposito-garantia de una propiedad en caba O seguro de caución- ingresos demostrables-contratar seguro contra incendio-Edificio de 9 Pisos-4 departamentos por piso-1 ascensor-Termotanque Eléctrico-Espacio para lavarropas-Baño completo-Piso cerámico Medidas de los ambientes: -Ambiente 2, 70 x 6, 90-Baño 1, 50 x 3- Balcón 1, 30 x 2, 70 Ley 5115 caba art. 1°: Los avisos publicados por corredores inmobiliarios por cualquier medio gráfico o informático, que promuevan operaciones inmobiliarias, deberán contener información acerca de las condiciones de accesibilidad para las personas con discapacidades físicas. art. 2°: Los avisos mencionados en el art. 1° incluirán un indicador gráfico de accesibilidad y/o la palabra &quot;accesible&quot;. Néstor Rubén Varela cucicba Matrícula Nº 2760Artículo 4° Ley 2340- Ente responsable. La matrícula de los corredores inmobiliarios estará a cargo del ente público no estatal, con independencia funcional de los poderes del Estado que se crea por esta ley. tasamos en caba en el día. Tomamos propiedades en caba como parte de pago Y/O financiamos.",https://www.zonaprop.com.ar/propiedades/clasificado/alclapin-departamento-en-alq.-monoambiente-6-piso-c-balcona-55762418.html,2025-05-28 02:09:31.645851,4,ARS,370000,Flores,13214.285714285714,460000.0,Muy pequeño
