precio_alquiler,expensas,direccion,superficie,ambientes,habitaciones,banos,descripcion,url,scraped_at,pagina,moneda_original,precio_alquiler_original,barrio,precio_por_m2,costo_total,categoria_tamano
420000,135000.0,Franklin 1900,35.0,2,1.0,1.0,"Corredor Responsable: Patricia Maria Sodor cucicba 5414 / csi 6061- Contacto: Marcelo Tischler. alquiler departamento dos ambientes caballito. Departamento ubicado en un segundo piso contrafrente, luminoso. - Living-comedor con balcón francés, piso de cerámica. , muy luminoso- Dormitorio con ventana al exterior luminoso, piso de parquet y amplio placard empotrado. - Baño completo con bañera y ventilación natural. - Cocina independiente, con mueble sobre y bajo mesada, cocina cuatro hornallas y horno a gas. - Lavadero independiente con espacio para lavarropas y calefón a gas. - edificio. Pisos: 8. Departamentos: 23. ubicacion. Sobre calle Franklin entre Terrero y Andrés Lamas. Cercanía 200 mts. Plaza Irlanda. Cercanía 300 mts. Policlínico Bancario. 100 mts. Av. Gaona. 200 mts. Calle Tte. Gral. Donato Álvarez. requisitos. un mes adelantado. un mes de deposito en dolares equivalente al primer mes de alquiler. demostración de ingresos. garantía: seguro de caucion woranz excluyente. contrato 24 meses. actualización trimestral indice ipc. transportes cercanos. Colectivos: 44, 76, 84, 99, 106, 113, 124, 181. Datos útiles. Barrio: Flores. Comuna: Comuna 7. Área Hospitalaria: htal. Dr. T. álvarez. Comisaría Comunal: 7. Comisaría Vecinal: 7C. Distrito Escolar: Distrito Escolar xii. Código Postal: 1406. Remax Argentina S. R. L. No ejerce el corretaje inmobiliario. El presente sitio web es una plataforma en donde cada oficina inmobiliaria independiente que contrata los servicios re/max puede publicar las propiedades a su cargo. Cada oficina es de propiedad y gestión independiente, por lo que Remax Argentina S. R. L no interviene en los datos de la publicación, en la operación inmobiliaria, ni en la confección y/o firma del boleto de compraventa y/o escritura y/o contrato de alquiler. En cumplimiento de las leyes vigentes que regulan el corretaje inmobiliario, Ley Nacional 25. 028, Ley 22. 802 de Lealtad Comercial, Ley 24. 240 de Defensa al Consumidor, las normas del Código Civil y Comercial de la Nación y Constitucionales, los agentes/gestores no ejercen el corretaje inmobiliario. Todas las operaciones inmobiliarias son objeto de intermediación y conclusión por parte del corredor público inmobiliario colegiado a cargo de la publicación, cuyos datos se exhiben en la presente. La presente publicación describe las características esenciales del inmueble, debiéndose consultar al corredor público inmobiliario responsable de la operación por la eventual actualización de las medidas, descripciones arquitectónicas y funcionales, valores de expensas, servicios, impuestos, precios y demás información, cuyos valores son aproximados. Para los casos de alquiler de vivienda, el monto máximo de comisión que se le puede requerir a los propietarios será el equivalente al cuatro con quince centésimos por ciento (4, 15%) del valor total del respectivo contrato. Se encuentra prohibido cobrar a los inquilinos que sean personas físicas comisiones inmobiliarias y gastos de gestoría de informes. El inmueble no es accesible para personas con discapacidades físicas.",https://www.zonaprop.com.ar/propiedades/clasificado/alclapin-alquiler-departamento-dos-ambientes-caballito-56330290.html,2025-05-28 02:26:22.811171,9,ARS,420000,Flores,12000.0,555000.0,Pequeño
440000,160000.0,BOYACA 620,39.0,2,1.0,1.0,"Excelente semipiso al contrafrente con balcon. comodidades hall de entrada 1. 35 X 1. 25. living comedor 5. 05 X 3. 00. hall de distribución 2. 10 X 1. 00. dormitorio 3. 10 X 3. 00 con amplio placard. cocina integrada 3. 00 X 2. 00 con desayunador Y. lavadero incorporado. Baño instalado completo. 2. 10 X 1. 80. balcon de 2. 30 X 1. 00. detalles agua caliente por calefón. Calefacción por estufa tiro balanceado. Pisos de living comedor en parquet plastificado. Cocina con piso Y revestimientos en céramica esmaltada. equipada con mueble bajo mesada, alacenas colgantes, mesada en “L” de granito gris mara, barra desayunadora en. madera lustrada, cocina con 4 quemadores horno Y parrilla. Baño completo con luz Y ventilación natural, pisos Y. revestimiento en cerámica, dormitorio piso alfombrado, placard con interiores. Muy luminoso con vista abierta, . Semipiso al contrafrente - superficie total 39 M/C aprox. edificio de 12 pisos 2 deptos por piso. expensas $ 160. 000 aprox. Requisitos: garantia A satisfaccion del propietario, comprobantes de ingreso justificados – gastos de luz - gas - Aysa – abl Y expensas comunes A cargo del locatario. Nota: Las medidas, superficies y detalles consignadas en el presente folleto son aproximados y al solo efecto orientativo. Las medidas originales surgirán del título de propiedad respectivo.",https://www.zonaprop.com.ar/propiedades/clasificado/alclapin-depto-semipiso-2-amplios-amb.-al-contrafrente-con-55772456.html,2025-05-28 02:26:25.943688,9,ARS,440000,Flores,11282.051282051281,600000.0,Pequeño
1100000,236000.0,Avenida Juan Bautista Alberdi,120.0,4,3.0,2.0,"Amplio y luminoso departamento de 4 ambientes en semipiso, con palier privado. Cuenta con un espacioso living comedor. Cocina comedor equipada con ventilador de techo, con extractor y excelente circulación de aire. Balcón corrido amplio con cerramiento. El dormitorio principal posee baño en suite y todos los dormitorios cuentan con amplios placares. Además, dispone de un baño principal completo con ante baño. Amplio lavadero independiente con baulera. Todos los ambientes tienen aire acondicionado y la calefacción es por radiadores, mediante caldera individual. Ubicación ideal: a solo tres cuadras de la estación San Pedrito (Línea A del subte). El edificio cuenta con varias cámaras de seguridad que pueden visualizarse mediante una app. ¡Una excelente opción para quienes buscan comodidad, amplitud y excelente conectividad! Requisitos. Contrato por 24 meses o menos. Actualización trimestral por ipc. Garantía de C. A. B. A O seguro de Caución. Mes de adelante. Mes de deposito en dolares",https://www.zonaprop.com.ar/propiedades/clasificado/alclappa-amplio-cuatro-ambientes-en-flores-dueno-directo-56094865.html,2025-05-28 02:26:30.970662,9,ARS,1100000,Flores,9166.666666666666,1336000.0,Grande
400000,120000.0,Rivadavia al 6200,36.0,2,1.0,1.0,Departamento de dos ambientes con balcón francés internoCocina separada con artefactos a gas. No cuenta con conexión para lavarropasLiving con pisos de cerámica. Habitación con placar empotrado. El edificio es apto profesional con seguridad 24 hs. Requisitos: garantía de capital o seguro de caución y justificación de ingresos. Ubicado sobre Av. Rivadavia a una cuadra de Av. Carabobo y media cuadra de la linea A de subte. Contrato a dos años con ajuste trimestral por inflación (ipc),https://www.zonaprop.com.ar/propiedades/clasificado/alclapin-av-rivadavia-6200-2-ambientes-interno-seguridad-55764156.html,2025-05-28 02:26:35.985556,9,ARS,400000,Flores,11111.111111111111,520000.0,Pequeño
800000,,"Nazca Palace (663) Excepc Unidades DE 2,3, Y 4 AMB Todos EN Suite +coch +baul Optat",54.0,2,1.0,1.0,"Excepcional y Amplio 2 Ambientes &quot; A estrenar&quot; Apto vivienda y/o Profesional con balcón aterrazado y terminaciones de excelente categoría- Amplia cocina completa con anafe y horno marca &quot;Domec&quot; semi abierta al Living Comedor con Dormitorio en suite y toilette. - Excelente Dormitorio, - Edificio con excepcional sector de parrillas y S. U. M. - Portero Electrico digital con control de acceso y Seguridad 24 hs &quot;shomer&quot; apto shabat. - Cocheras fija y bauleras individuales optativas.",https://www.zonaprop.com.ar/propiedades/clasificado/alclapin-exc-2-amb-a-estrenar-bcon-aterraz-dorm-en-ste-toil-coc-55350390.html,2025-05-28 02:26:40.520633,9,USD,800,Flores,14814.814814814816,800000.0,Mediano
540000,70000.0,Portela 50,40.0,1,0.0,1.0,"Monoambiente Impecable a Estrenar en Alquiler con Balcón (opcional cochera) Ubicado en el barrio de flores, este moderno monoambiente es ideal para quienes buscan confort y calidad en cada detalle. Ver video adjunto con las fotos* Características del Departamento: +Monoambiente con Balcón: Amplio y luminoso, con una excelente orientación oeste, lo que garantiza gran iluminación natural. +Baño completo con ducha, bañera y bidet. +Vista al contrafrente, asegurando tranquilidad y privacidad. +Apto Profesional. +Placard espacioso, de dos puertas corredizas. +Opcional cochera. Comodidades y Equipamiento: +3 ascensores automáticos con interiores de acero inoxidable y espejo. +Puertas de seguridad con triple cerrojo y mirilla panorámica. +Pisos y zócalos de porcelanato de alta calidad. +Vidrios de seguridad blisan 3+3mm: resistentes al impacto y aislantes acústicos. +Baños revestidos en porcelanato. +Griferías monocomando, sanitarios y vanitorys de primera marca. +Cocina equipada con muebles completos, (alacena + bajomesada) +Cocina eléctrica con horno marca líder de 4 hornallas. +Mesadas graníticas y bachas de acero inoxidable. +Agua caliente central mediante boiler y calderas de alta recuperación. +Sistema de calefacción/refrigeración tipo Split de primera marca. Servicios y Adicionales: +Terraza. +Aire acondicionado. +Parrillas y solarium. +sum (Salón de Usos Múltiples) con cocina completa, aire acondicionado y placard. +Laundry en cada piso (necesita lavarropas propio). +Seguridad las 24 horas y portería. +Apto profesional. +Calefacción por aire acondicionado. +Espacios comunes de calidad superior. Este monoambiente es perfecto tanto para quienes deseen vivir en un espacio cómodo y moderno como para quienes necesiten un lugar apto profesional. ¡No te pierdas la oportunidad de vivir en un lugar único! Contáctanos y coordina tu visita",https://www.zonaprop.com.ar/propiedades/clasificado/alclapin-monoambiente-a-estrenar-con-balcon-56158380.html,2025-05-28 02:26:43.550013,9,ARS,540000,Flores,13500.0,610000.0,Pequeño
850000,98000.0,Bogota,79.0,4,3.0,1.0,"Hermoso y amplio departamento en Flores, al frente con balcón. Muy luminoso. Living comedor, 3 amplios dormitorios con placares, uno de ellos al frente. Cocina completa con muebles bajo mesada y alacenas. Lavadero con instalación para lavarropas. Excelente ubicación, a una cuadra de la calle Avellaneda y a dos cuadras de Plaza Flores. Múltiples medios de transporte (colectivos, subte y tren). Digno de ver. Aviso legal: Las descripciones arquitectónicas y funcionales, valores de expensas, impuestos y servicios, fotos y medidas de este inmueble son aproximados. Los datos fueron proporcionados por el propietario y pueden no estar actualizados a la hora de la visualización de este aviso por lo cual pueden arrojar inexactitudes y discordancias con las que surgen de los las facturas, títulos y planos legales del inmueble. El interesado deberá realizar las verificaciones respectivas previamente a la realización de cualquier operación, requiriendo por sí o sus profesionales las copias necesarias de la documentación que corresponda.",https://www.zonaprop.com.ar/propiedades/clasificado/alclapin-hermoso-y-amplio-4-amb.-c-balcon-55848687.html,2025-05-28 02:26:45.328979,9,ARS,850000,Flores,10759.493670886075,948000.0,Mediano
400000,110000.0,Pedernera 100,32.0,1,0.0,1.0,"Alquiler departamento monoambiente super luminoso contrafrente con cochera por Pedernera 100, Flores. Apto profesional! La unidad cuenta con lo siguiente: Superficie Total: 32 mts2 aprox. Superficie Cubierta: 30 mts2 aprox. - Ambiente con salida al balcón. - Cocina integrada. - Calefacción por caldera y Aire acondicionado Frio/Calor. - Amplio S. U. M con parrilla. - Cochera. - Las expensas incluyen: Agua, luz, abl. *El departamento no tiene gas ni portero* Requisitos del alquiler: -Aumento trimestral segun indice de ipc. -Un mes de deposito. -Un mes por adelantado. -Seguro de Causión (finaer-respaldar ya) -Recibo de sueldo de los ultimos 6 meses (Que triplique el monto del alquiler) -Expensas incluyen internet, aysa, y luz. Para mas información o coordinar una visita comuníquese con la inmobiliaria Walter Porta al Ver datos o Ver datos. Solicite tasación: con más de 25 años en el mercado inmobiliario, brindando un servicio de excelencia, con honestidad, compromiso, atención profesional y personalizada. Aviso legal: Las descripciones arquitectónicas y funcionales, valores de expensas, impuestos y servicios, fotos y medidas de este inmueble son aproximados. Los datos fueron proporcionados por el propietario y pueden no estar actualizados a la hora de la visualización de este aviso por lo cual pueden arrojar inexactitudes y discordancias con las que surgen de los las facturas, títulos y planos legales del inmueble. El interesado deberá realizar las verificaciones respectivas previamente a la realización de cualquier operación, requiriendo por sí o sus profesionales las copias necesarias de la documentación que corresponda. Venta supeditada al cumplimiento por parte del propietario de los requisitos de la resolución general Nº 2371 de la afip (pedido de coti).",https://www.zonaprop.com.ar/propiedades/clasificado/alclapin-depto-a-estrenar-monoambiente-con-cochera-por-55554410.html,2025-05-28 02:26:49.231616,9,ARS,400000,Flores,12500.0,510000.0,Pequeño
375000,76000.0,Directorio 2200,32.0,1,0.0,1.0,"Directorio y Membrillar (Plaza Misericordia) depto. De 1 ambiente con placard, cocina separada, al frente con balcón. Muy linda vista abierta super luminoso. Pisos cerámicos. Baño completo con bañera. Apto profesional. Recién pintado. Muy buena ubicación cerca del Subte A Estación San José de Flores y Centro Comercial de Av. Rivadavia. Abl $9000. - Aysa $Ver datos. - Duración del contrato: 2 años. Ajuste trimestral por ipc. Se requiere garantía propietaria de caba o seguro de caución y justificación de ingresos. 1 mes de alquiler por adelantado y 1 mes de depósito en garantía. ""Para los casos de alquiler de vivienda, el monto máximo de comisión que se le puede requerir a los propietarios será el equivalente al cuatro con quince centésimos por ciento (4, 15%) del valor total del respectivo contrato. Se encuentra prohibido cobrar a los inquilinos que sean personas físicas comisiones inmobiliarias y gastos de gestoría de informes”.",https://www.zonaprop.com.ar/propiedades/clasificado/alclapin-directorio-y-membrillar:-1-amb-con-balcon-al-frente-53481464.html,2025-05-28 02:28:12.161185,10,ARS,375000,Flores,11718.75,451000.0,Pequeño
500000,100000.0,Departamento EN Alquiler 3 Ambientes Flores Buenos Aires,50.0,3,2.0,1.0,"Departamento 3 ambientes flores, campana al 400 luminosoideal estudiantes amoblado cerca de medios de transporte preparado para ingreso inmediato. el valor mensual no incluye expensas ni servicios cucicba 8306cp",https://www.zonaprop.com.ar/propiedades/clasificado/alclapin-departamento-en-alquiler-3-ambientes-flores-buenos-56339402.html,2025-05-28 02:28:15.438602,10,USD,500,Flores,10000.0,600000.0,Pequeño
625000,150000.0,Avellaneda 2700 5°,65.0,3,2.0,2.0,"¡Oportunidad única en Flores! Alquiler de espectacular departamento de 3 ambientes, recientemente pintado a nuevo, con excelente luminosidad en todos los espacios. Cuenta con: Amplio salón comedor lleno de luz natural. Cocina independiente con lavadero independiente. 2 dormitorios confortables con placares empotrados. Baño completo y toilette de cortesía. Ubicación privilegiada en Avellaneda al 2700, a pocos metros de Av. Nazca, Av. San Pedrito y Av. Rivadavia. Zona de fácil acceso y múltiples opciones de transporte. Para los casos de alquiler de vivienda, el monto máximo de comisión que se le puede requerir a los propietarios será el equivalente al cuatro con quince centésimos por ciento (4, 15%) del valor total del respectivo contrato. Se encuentra prohibido cobrar a los inquilinos que sean personas físicas comisiones inmobiliarias y gastos de gestoría de informes. ¡No dejes pasar esta oportunidad! Contáctanos para agendar una visita.",https://www.zonaprop.com.ar/propiedades/clasificado/alclapin-dpto-3amb-bcon-lav-bano-y-toil-lumin-pintado-a-nuevo-55905576.html,2025-05-28 02:28:18.287836,10,ARS,625000,Flores,9615.384615384615,775000.0,Mediano
850000,98000.0,Bogota,79.0,4,3.0,1.0,"Hermoso y amplio departamento en Flores, al frente con balcón. Muy luminoso. Living comedor, 3 amplios dormitorios con placares, uno de ellos al frente. Cocina completa con muebles bajo mesada y alacenas. Lavadero con instalación para lavarropas. Excelente ubicación, a una cuadra de la calle Avellaneda y a dos cuadras de Plaza Flores. Múltiples medios de transporte (colectivos, subte y tren). Digno de ver. Aviso legal: Las descripciones arquitectónicas y funcionales, valores de expensas, impuestos y servicios, fotos y medidas de este inmueble son aproximados. Los datos fueron proporcionados por el propietario y pueden no estar actualizados a la hora de la visualización de este aviso por lo cual pueden arrojar inexactitudes y discordancias con las que surgen de los las facturas, títulos y planos legales del inmueble. El interesado deberá realizar las verificaciones respectivas previamente a la realización de cualquier operación, requiriendo por sí o sus profesionales las copias necesarias de la documentación que corresponda.",https://www.zonaprop.com.ar/propiedades/clasificado/alclapin-hermoso-y-amplio-4-amb.-c-balcon-55848687.html,2025-05-28 02:28:24.033553,10,ARS,850000,Flores,10759.493670886075,948000.0,Mediano
450000,111000.0,Culpina al 100,51.0,2,1.0,1.0,"Planta Baja con patio, 2 ambientes. Departamento de 1 dormitorio con placard empotrado y piso de parquetLiving-comedor con ventana balcon y salida al patio. Cocina-comedor cubierto. 1 baño completo. Patio. Libre. requisitos: Contrato de Locacion por 1 año renovable, reajustado por icl cada 4 meses. Presentar garantía propietaria o seguro de caución Finaer o GarantiaYa y recibo de sueldo (ambas cosas si o si. )2 meses de deposito. Informes de garantía o gastos con seguro de caución, certificación de firmas ante escribano a cargo de El Locatario. A cargo de El Locatario: Servicios de Luz, gas, agua, expensas ordinarias y abl. Obligación de contratar seguro de incendio, póliza no inferior a $ Ver datos. -",https://www.zonaprop.com.ar/propiedades/clasificado/alclapin-alquiler-depto.-2-amb.-con-patio.-pb.-55988904.html,2025-05-28 02:28:29.483532,10,ARS,450000,Flores,8823.529411764706,561000.0,Mediano
320000,95000.0,Coronel Ramón Lorenzo Falcón 2900,25.0,1,0.0,1.0,"Corredor Responsable: guillermo frimet cucicba 4235 / Pablo Anibal Montenegro cpmcal 552- Contacto: Anabella Maucor. Alquiler moderno edificio que cuenta con sum, gimanasio Y lundry. Ubicado en el vibrante barrio de Flores, este encantador monoambiente es perfecto para quienes buscan comodidad y excelente conectividad. Con una ubicación inmejorable a solo 100 metros de la estación San Pedrito de la Línea A del subte, disfrutarás de fácil acceso a todo lo que la ciudad tiene para ofrecer. El departamento destaca por su luminosidad, gracias a sus amplias ventanas y un balcón privado que da a la calle, ideal para relajarte al aire libre. El espacio cuenta con un práctico placard y está completamente equipado con todo lo eléctrico necesario, lo que añade comodidad y funcionalidad a tu día a día. Este monoambiente no solo ofrece una gran calidad de vida sino también una conectividad inmejorable con medios de transporte y servicios cercanos. No pierdas la oportunidad de vivir en este atractivo espacio en una ubicación clave. ¡Contáctanos hoy mismo para agendar una visita! Remax Argentina S. R. L. No ejerce el corretaje inmobiliario. El presente sitio web es una plataforma en donde cada oficina inmobiliaria independiente que contrata los servicios re/max puede publicar las propiedades a su cargo. Cada oficina es de propiedad y gestión independiente, por lo que Remax Argentina S. R. L no interviene en los datos de la publicación, en la operación inmobiliaria, ni en la confección y/o firma del boleto de compraventa y/o escritura y/o contrato de alquiler. En cumplimiento de las leyes vigentes que regulan el corretaje inmobiliario, Ley Nacional 25. 028, Ley 22. 802 de Lealtad Comercial, Ley 24. 240 de Defensa al Consumidor, las normas del Código Civil y Comercial de la Nación y Constitucionales, los agentes/gestores no ejercen el corretaje inmobiliario. Todas las operaciones inmobiliarias son objeto de intermediación y conclusión por parte del corredor público inmobiliario colegiado a cargo de la publicación, cuyos datos se exhiben en la presente. La presente publicación describe las características esenciales del inmueble, debiéndose consultar al corredor público inmobiliario responsable de la operación por la eventual actualización de las medidas, descripciones arquitectónicas y funcionales, valores de expensas, servicios, impuestos, precios y demás información, cuyos valores son aproximados. Para los casos de alquiler de vivienda, el monto máximo de comisión que se le puede requerir a los propietarios será el equivalente al cuatro con quince centésimos por ciento (4, 15%) del valor total del respectivo contrato. Se encuentra prohibido cobrar a los inquilinos que sean personas físicas comisiones inmobiliarias y gastos de gestoría de informes. El inmueble no es accesible para personas con discapacidades físicas.",https://www.zonaprop.com.ar/propiedades/clasificado/alclapin-alquiler-monoambiente-en-flores-con-balcon-56179583.html,2025-05-28 02:28:33.963119,10,ARS,320000,Flores,12800.0,415000.0,Muy pequeño
650000,130000.0,Boyacá 200,60.0,2,1.0,1.0,"Unico 2 ambientes s/piso a estrenar, 60 mts totales, orientación este, vista abierta. Bajas expensas. Requisitos. -Un mes de adelanto. -Un mes de depósito. -Ingresos comprobables. -Propiedad en Garantía de caba o Seguro de Caución (finaer) -Contrato por 24 meses. -Indexación trimestral. (indec x ipc) Safier Pedro Omar Negocios inmobiliarios C. U. C. I. C. B. A. Matrícula Nº 1720. aviso legal: Las descripciones arquitectónicas y funcionales, impuestos, expensas y servicios, fotos y medidas de este inmueble son aproximados. Los datos fueron proporcionados por el propietario y pueden no estar actualizados a la hora de la visualización de este aviso por lo cual pueden arrojar inexactitudes y discordancias con las que surgen de las/los facturas, títulos y planos legales del inmueble. El interesado deberá realizar las verificaciones respectivas previamente a la realización de cualquier operación, requiriendo por sí o sus profesionales las copias necesarias de la documentación que corresponda. Ley 5115 – La publicación de accesibilidad a los inmuebles. Artículo 1º. - Los avisos publicados por corredores inmobiliarios por cualquier medio gráfico o informático, que promuevan operaciones inmobiliarias, deberán contener información acerca de las condiciones de accesibilidad para las personas con discapacidades físicas. Artículo 2º. - Los avisos mencionados en el art. 1° incluirán un indicador gráfico de accesibilidad y/o la palabra ""accesible"". Esta unidad no es apta para personas con movilidad reducida. Art. 10 de Ley 2340 ""Para los casos de alquiler de vivienda, el monto máximo de comisión que se le puede requerir a los propietarios será el equivalente al cuatro con quince centésimos por ciento (4, 15%) del valor total del respectivo contrato. Se encuentra prohibido cobrar a los inquilinos que sean personas físicas comisiones inmobiliarias"". -",https://www.zonaprop.com.ar/propiedades/clasificado/alclapin-excelente-2-amb-s-piso-a-estrenar-c-bcon-terraza.-56062213.html,2025-05-28 02:28:39.677082,10,ARS,650000,Flores,10833.333333333334,780000.0,Mediano
550000,80000.0,Moron 2442,47.0,2,1.0,1.0,Hermoso 2 amb refaccionado - 47 m2 - 1º X escalera - bajas expensasbaño completo Y cocina A estrenargavilán propiedadesVer datos/6570 - wpp (mensaje): 11 Ver datosgavilan propiedadesfijo: Ver datos/6570 - Mensaje de Wpp: Ver datos,https://www.zonaprop.com.ar/propiedades/clasificado/alclapin-hermoso-2-amb-refaccionado-47-m-sup2--bajas-56228351.html,2025-05-28 02:28:44.595730,10,ARS,550000,Flores,11702.127659574468,630000.0,Pequeño
400000,50000.0,Av. Boyaca 2037,37.0,1,0.0,1.0,"Excelente Monoambiente al Fte. Con Balcón. Muy buen edificio. Excelente estado. Actualizado trimestralmente por ipc. - Para visitas comunicarse con el Sr. Omar al Ver datos al Tel o Watsapp, de Lunes a Viernes de 10 a 18 Hs.",https://www.zonaprop.com.ar/propiedades/clasificado/alclapin-flores-excelente-monoambiente-al-fte.-con-balcon-55581337.html,2025-05-28 02:28:47.182426,10,ARS,400000,Flores,10810.81081081081,450000.0,Pequeño
430000,163000.0,Av. San Pedrito 200 8°,49.0,2,1.0,1.0,"Departamento de 2 ambientes con balcón al frente muy luminoso. Living comedor con pisos de cerámicos con salida a balcón corrido al frente, cocina separada con espacio para instalación de lavarropa, dormitorio con placard y pisos de cerámicos, baño completo. La propiedad esta ubicada sobre la Av. San Pedrito, a media cuadra de Av. Juan B. Alberdi, a una cuadra de Av. Directorio, a dos cuadras de la linea de subte A, a nueve cuadras de la linea de subte E. Observación: -Las superficies, medidas y expensas son aproximadas y al solo efecto orientativo. -Las medidas reales son las que surgirán del titulo de propiedad respectivo. -Los montos especificados de expensas responden a una declaración del propietario, verificar el monto actualizado.",https://www.zonaprop.com.ar/propiedades/clasificado/alclapin-2-ambientes-al-frente-con-balcon.-55828016.html,2025-05-28 02:28:50.584772,10,ARS,430000,Flores,8775.510204081633,593000.0,Pequeño
